{
  "schema_version": 1,
  "run_id": "fixture-run",
  "phase_id": "phase-1",
  "conversation_id": "conversation-1",
  "investigation_status": "CONCLUDED",
  "implementation_status": "NOT_REQUESTED",
  "product_status": "UNKNOWN",
  "current_wave": 1,
  "spec_revision": "fixture-run:wave-1:abc",
  "correlation_id": "corr-1",
  "boss_checkpoint_every": 10,
  "checkpoint_10_completed": false,
  "checkpoint_20_completed": false,
  "wave_cap": 20,
  "max_slot_attempts": 2,
  "pending_action": "NONE",
  "waiting_reason": null,
  "latest_decision_id": "dec-1",
  "latest_proposal_id": "prop-1",
  "pending_delivery_event_id": "event-1",
  "delivery_ref": "loops/fixture-run/deliveries/event-1/lifecycle.json",
  "implementation_authorized": false,
  "continuation_policy": "ONE_WAVE",
  "executor_mode": "CURSOR",
  "state_revision": 1,
  "previous_state_revision": null,
  "previous_state_sha256": null,
  "spec_ref": "loops/fixture-run/wave-1/specs/0001.yaml",
  "preflight_ref": "loops/fixture-run/wave-1/preflights/0001.yaml",
  "awaiting_input": null,
  "pending_action_id": null,
  "last_applied_action_id": null
}
